{
  "title": "Orna portable sys API",
  "language_version": "1.1.0",
  "sys_version": "1.1",
  "status": "Final 1.1.0 specification contract; engine execution not claimed",
  "removed_names": {
    "sys.runtime": {
      "replacement": "sys.rt",
      "diagnostic": "ORNA100-E-SYS-RUNTIME"
    },
    "sys.runtime_info": {
      "replacement": "sys.rt.info",
      "diagnostic": "ORNA100-E-SYS-RUNTIME"
    },
    "sys.admin.set_storage_preference": {
      "replacement": null,
      "diagnostic": "sys.version.incompatible",
      "reason": "No new-format row placement mode; migrate source explicitly."
    },
    "sys.admin.rewrite_storage": {
      "replacement": null,
      "diagnostic": "sys.version.incompatible",
      "reason": "No new-format row placement mode; migrate source explicitly."
    }
  },
  "singletons": [
    {
      "name": "sys.database",
      "type": "sys.DatabaseView",
      "availability": "always while a database is attached"
    },
    {
      "name": "sys.current",
      "type": "sys.CurrentContext",
      "availability": "every activation"
    },
    {
      "name": "sys.rt",
      "type": "sys.RuntimeView",
      "availability": "every command/runtime owner"
    },
    {
      "name": "sys.repl",
      "type": "sys.ReplView",
      "availability": "REPL only; otherwise sys.context.repl_unavailable"
    }
  ],
  "opaque_identifiers": [
    "sys.DatabaseId",
    "sys.FileId",
    "sys.DefinitionId",
    "sys.ObjectId",
    "sys.RevisionId",
    "sys.SnapshotId",
    "sys.RuntimeId",
    "sys.TransactionId",
    "sys.InvocationId",
    "sys.RunId",
    "sys.QueryId",
    "sys.SessionId",
    "sys.ClientId",
    "sys.TraceId",
    "sys.SpanId",
    "sys.CheckpointVersion",
    "sys.SegmentId",
    "sys.BuildId",
    "sys.GitOid",
    "sys.FailureVersion",
    "sys.ConsumerIdentity"
  ],
  "reference_aliases": [
    {
      "name": "sys.DatabaseRef",
      "target": "sys.Database",
      "definition": "sys.RowRef<sys.Database>"
    },
    {
      "name": "sys.NamespaceRef",
      "target": "sys.Namespace",
      "definition": "sys.RowRef<sys.Namespace>"
    },
    {
      "name": "sys.ModuleRef",
      "target": "sys.Module",
      "definition": "sys.RowRef<sys.Module>"
    },
    {
      "name": "sys.ImportRef",
      "target": "sys.Import",
      "definition": "sys.RowRef<sys.Import>"
    },
    {
      "name": "sys.FileRef",
      "target": "sys.File",
      "definition": "sys.RowRef<sys.File>"
    },
    {
      "name": "sys.ObjectRef",
      "target": "sys.Object",
      "definition": "sys.RowRef<sys.Object>"
    },
    {
      "name": "sys.RevisionRef",
      "target": "sys.Revision",
      "definition": "sys.RowRef<sys.Revision>"
    },
    {
      "name": "sys.DefinitionRef",
      "target": "sys.Definition",
      "definition": "sys.RowRef<sys.Definition>"
    },
    {
      "name": "sys.TypeRef",
      "target": "sys.Type",
      "definition": "sys.RowRef<sys.Type>"
    },
    {
      "name": "sys.TypeParameterRef",
      "target": "sys.TypeParameter",
      "definition": "sys.RowRef<sys.TypeParameter>"
    },
    {
      "name": "sys.FieldRef",
      "target": "sys.Field",
      "definition": "sys.RowRef<sys.Field>"
    },
    {
      "name": "sys.VariantRef",
      "target": "sys.Variant",
      "definition": "sys.RowRef<sys.Variant>"
    },
    {
      "name": "sys.ProtocolRef",
      "target": "sys.Protocol",
      "definition": "sys.RowRef<sys.Protocol>"
    },
    {
      "name": "sys.ProtocolMemberRef",
      "target": "sys.ProtocolMember",
      "definition": "sys.RowRef<sys.ProtocolMember>"
    },
    {
      "name": "sys.ImplementationRef",
      "target": "sys.Implementation",
      "definition": "sys.RowRef<sys.Implementation>"
    },
    {
      "name": "sys.FunctionRef",
      "target": "sys.Function",
      "definition": "sys.RowRef<sys.Function>"
    },
    {
      "name": "sys.ParameterRef",
      "target": "sys.Parameter",
      "definition": "sys.RowRef<sys.Parameter>"
    },
    {
      "name": "sys.EffectRef",
      "target": "sys.Effect",
      "definition": "sys.RowRef<sys.Effect>"
    },
    {
      "name": "sys.TableRef",
      "target": "sys.Table",
      "definition": "sys.RowRef<sys.Table>"
    },
    {
      "name": "sys.ColumnRef",
      "target": "sys.Column",
      "definition": "sys.RowRef<sys.Column>"
    },
    {
      "name": "sys.KeyRef",
      "target": "sys.Key",
      "definition": "sys.RowRef<sys.Key>"
    },
    {
      "name": "sys.AssertionRef",
      "target": "sys.Assertion",
      "definition": "sys.RowRef<sys.Assertion>"
    },
    {
      "name": "sys.ReferenceRef",
      "target": "sys.Reference",
      "definition": "sys.RowRef<sys.Reference>"
    },
    {
      "name": "sys.PageRef",
      "target": "sys.Page",
      "definition": "sys.RowRef<sys.Page>"
    },
    {
      "name": "sys.DimensionRef",
      "target": "sys.Dimension",
      "definition": "sys.RowRef<sys.Dimension>"
    },
    {
      "name": "sys.UnitRef",
      "target": "sys.Unit",
      "definition": "sys.RowRef<sys.Unit>"
    },
    {
      "name": "sys.CurrencyRef",
      "target": "sys.Currency",
      "definition": "sys.RowRef<sys.Currency>"
    },
    {
      "name": "sys.SecretRequirementRef",
      "target": "sys.SecretRequirement",
      "definition": "sys.RowRef<sys.SecretRequirement>"
    },
    {
      "name": "sys.ExtensionRef",
      "target": "sys.Extension",
      "definition": "sys.RowRef<sys.Extension>"
    },
    {
      "name": "sys.DependencyRef",
      "target": "sys.Dependency",
      "definition": "sys.RowRef<sys.Dependency>"
    },
    {
      "name": "sys.DiagnosticRef",
      "target": "sys.Diagnostic",
      "definition": "sys.RowRef<sys.Diagnostic>"
    },
    {
      "name": "sys.SnapshotRef",
      "target": "sys.Snapshot",
      "definition": "sys.RowRef<sys.Snapshot>"
    },
    {
      "name": "sys.SnapshotObjectRef",
      "target": "sys.SnapshotObject",
      "definition": "sys.RowRef<sys.SnapshotObject>"
    },
    {
      "name": "sys.ChangeRef",
      "target": "sys.Change",
      "definition": "sys.RowRef<sys.Change>"
    },
    {
      "name": "sys.DiffEntryRef",
      "target": "sys.DiffEntry",
      "definition": "sys.RowRef<sys.DiffEntry>"
    },
    {
      "name": "sys.FileVersionRef",
      "target": "sys.FileVersion",
      "definition": "sys.RowRef<sys.FileVersion>"
    },
    {
      "name": "sys.GitRepositoryRef",
      "target": "sys.GitRepository",
      "definition": "sys.RowRef<sys.GitRepository>"
    },
    {
      "name": "sys.CommitRef",
      "target": "sys.Commit",
      "definition": "sys.RowRef<sys.Commit>"
    },
    {
      "name": "sys.TreeEntryRef",
      "target": "sys.TreeEntry",
      "definition": "sys.RowRef<sys.TreeEntry>"
    },
    {
      "name": "sys.RefRef",
      "target": "sys.Ref",
      "definition": "sys.RowRef<sys.Ref>"
    },
    {
      "name": "sys.BranchRef",
      "target": "sys.Branch",
      "definition": "sys.RowRef<sys.Branch>"
    },
    {
      "name": "sys.TagRef",
      "target": "sys.Tag",
      "definition": "sys.RowRef<sys.Tag>"
    },
    {
      "name": "sys.RemoteRef",
      "target": "sys.Remote",
      "definition": "sys.RowRef<sys.Remote>"
    },
    {
      "name": "sys.StashRef",
      "target": "sys.Stash",
      "definition": "sys.RowRef<sys.Stash>"
    },
    {
      "name": "sys.GitObjectRef",
      "target": "sys.GitObject",
      "definition": "sys.RowRef<sys.GitObject>"
    },
    {
      "name": "sys.WorktreeEntryRef",
      "target": "sys.WorktreeEntry",
      "definition": "sys.RowRef<sys.WorktreeEntry>"
    },
    {
      "name": "sys.QueryRef",
      "target": "sys.Query",
      "definition": "sys.RowRef<sys.Query>"
    },
    {
      "name": "sys.PlanRef",
      "target": "sys.Plan",
      "definition": "sys.RowRef<sys.Plan>"
    },
    {
      "name": "sys.PlanNodeRef",
      "target": "sys.PlanNode",
      "definition": "sys.RowRef<sys.PlanNode>"
    },
    {
      "name": "sys.InvocationRef",
      "target": "sys.Invocation",
      "definition": "sys.RowRef<sys.Invocation>"
    },
    {
      "name": "sys.InvocationArgumentRef",
      "target": "sys.InvocationArgument",
      "definition": "sys.RowRef<sys.InvocationArgument>"
    },
    {
      "name": "sys.RunRef",
      "target": "sys.Run",
      "definition": "sys.RowRef<sys.Run>"
    },
    {
      "name": "sys.TransactionRef",
      "target": "sys.Transaction",
      "definition": "sys.RowRef<sys.Transaction>"
    },
    {
      "name": "sys.TraceRef",
      "target": "sys.Trace",
      "definition": "sys.RowRef<sys.Trace>"
    },
    {
      "name": "sys.SpanRef",
      "target": "sys.Span",
      "definition": "sys.RowRef<sys.Span>"
    },
    {
      "name": "sys.TraceEventRef",
      "target": "sys.TraceEvent",
      "definition": "sys.RowRef<sys.TraceEvent>"
    },
    {
      "name": "sys.StreamRef",
      "target": "sys.Stream",
      "definition": "sys.RowRef<sys.Stream>"
    },
    {
      "name": "sys.CheckpointRef",
      "target": "sys.Checkpoint",
      "definition": "sys.RowRef<sys.Checkpoint>"
    },
    {
      "name": "sys.CheckpointUpdateRef",
      "target": "sys.CheckpointUpdate",
      "definition": "sys.RowRef<sys.CheckpointUpdate>"
    },
    {
      "name": "sys.FailureRef",
      "target": "sys.Failure",
      "definition": "sys.RowRef<sys.Failure>"
    },
    {
      "name": "sys.SessionRef",
      "target": "sys.Session",
      "definition": "sys.RowRef<sys.Session>"
    },
    {
      "name": "sys.ClientRef",
      "target": "sys.Client",
      "definition": "sys.RowRef<sys.Client>"
    },
    {
      "name": "sys.LeaseRef",
      "target": "sys.Lease",
      "definition": "sys.RowRef<sys.Lease>"
    },
    {
      "name": "sys.ListenerRef",
      "target": "sys.Listener",
      "definition": "sys.RowRef<sys.Listener>"
    },
    {
      "name": "sys.StorageRef",
      "target": "sys.Storage",
      "definition": "sys.RowRef<sys.Storage>"
    },
    {